{
  "schema_version": "bb.e4.target_coverage.v1",
  "target_family": "oh_my_opencode",
  "frozen_target_versions": [
    "oh-my-opencode-frozen-target-pending"
  ],
  "generated_at_utc": "2026-07-03T00:00:00Z",
  "rows": [
    {
      "behavior_family": "config_graph",
      "behavior_id": "oh_my_opencode_config_graph",
      "description": "No accepted D3 target-support row mapped for oh_my_opencode config_graph.",
      "status": "not_started",
      "claim_refs": [],
      "blocked_reason": "No accepted D3 target-support lane in current inventory."
    },
    {
      "behavior_family": "context_pack",
      "behavior_id": "oh_my_opencode_context_pack",
      "description": "No accepted D3 target-support row mapped for oh_my_opencode context_pack.",
      "status": "not_started",
      "claim_refs": [],
      "blocked_reason": "No accepted D3 target-support lane in current inventory."
    },
    {
      "behavior_family": "capability_surface",
      "behavior_id": "oh_my_opencode_capability_surface",
      "description": "No accepted D3 target-support row mapped for oh_my_opencode capability_surface.",
      "status": "not_started",
      "claim_refs": [],
      "blocked_reason": "No accepted D3 target-support lane in current inventory."
    },
    {
      "behavior_family": "tool_execution",
      "behavior_id": "oh_my_opencode_tool_execution",
      "description": "No accepted D3 target-support row mapped for oh_my_opencode tool_execution.",
      "status": "not_started",
      "claim_refs": [],
      "blocked_reason": "No accepted D3 target-support lane in current inventory."
    },
    {
      "behavior_family": "command_network_policy",
      "behavior_id": "oh_my_opencode_command_network_policy",
      "description": "No accepted D3 target-support row mapped for oh_my_opencode command_network_policy.",
      "status": "not_started",
      "claim_refs": [],
      "blocked_reason": "No accepted D3 target-support lane in current inventory."
    },
    {
      "behavior_family": "protocol_sessions",
      "behavior_id": "oh_my_opencode_protocol_sessions",
      "description": "No accepted D3 target-support row mapped for oh_my_opencode protocol_sessions.",
      "status": "not_started",
      "claim_refs": [],
      "blocked_reason": "No accepted D3 target-support lane in current inventory."
    },
    {
      "behavior_family": "resource_access",
      "behavior_id": "oh_my_opencode_resource_access",
      "description": "No accepted D3 target-support row mapped for oh_my_opencode resource_access.",
      "status": "not_started",
      "claim_refs": [],
      "blocked_reason": "No accepted D3 target-support lane in current inventory."
    },
    {
      "behavior_family": "provider_routing",
      "behavior_id": "oh_my_opencode_provider_routing",
      "description": "No accepted D3 target-support row mapped for oh_my_opencode provider_routing.",
      "status": "not_started",
      "claim_refs": [],
      "blocked_reason": "No accepted D3 target-support lane in current inventory."
    },
    {
      "behavior_family": "memory_compaction",
      "behavior_id": "oh_my_opencode_memory_compaction",
      "description": "No accepted D3 target-support row mapped for oh_my_opencode memory_compaction.",
      "status": "not_started",
      "claim_refs": [],
      "blocked_reason": "No accepted D3 target-support lane in current inventory."
    },
    {
      "behavior_family": "work_items",
      "behavior_id": "oh_my_opencode_work_items",
      "description": "No accepted D3 target-support row mapped for oh_my_opencode work_items.",
      "status": "not_started",
      "claim_refs": [],
      "blocked_reason": "No accepted D3 target-support lane in current inventory."
    },
    {
      "behavior_family": "side_effects",
      "behavior_id": "oh_my_opencode_side_effects",
      "description": "No accepted D3 target-support row mapped for oh_my_opencode side_effects.",
      "status": "not_started",
      "claim_refs": [],
      "blocked_reason": "No accepted D3 target-support lane in current inventory."
    },
    {
      "behavior_family": "projection_ui",
      "behavior_id": "oh_my_opencode_projection_ui",
      "description": "No accepted D3 target-support row mapped for oh_my_opencode projection_ui.",
      "status": "not_started",
      "claim_refs": [],
      "blocked_reason": "No accepted D3 target-support lane in current inventory."
    },
    {
      "behavior_family": "session_persistence",
      "behavior_id": "oh_my_opencode_session_persistence",
      "description": "No accepted D3 target-support row mapped for oh_my_opencode session_persistence.",
      "status": "not_started",
      "claim_refs": [],
      "blocked_reason": "No accepted D3 target-support lane in current inventory."
    },
    {
      "behavior_family": "replay_capture",
      "behavior_id": "oh_my_opencode_replay_capture",
      "description": "No accepted D3 target-support row mapped for oh_my_opencode replay_capture.",
      "status": "not_started",
      "claim_refs": [],
      "blocked_reason": "No accepted D3 target-support lane in current inventory."
    },
    {
      "behavior_family": "other",
      "behavior_id": "oh_my_opencode_other",
      "description": "No accepted D3 target-support row mapped for oh_my_opencode other.",
      "status": "not_started",
      "claim_refs": [],
      "blocked_reason": "No accepted D3 target-support lane in current inventory."
    }
  ]
}
