{
  "schema_version": "bb.e4.target_coverage.v1",
  "target_family": "codex",
  "frozen_target_versions": [
    "codex-cli-gpt55-capture-probe-v1"
  ],
  "generated_at_utc": "2026-07-03T00:00:00Z",
  "rows": [
    {
      "behavior_family": "config_graph",
      "behavior_id": "codex_config_graph",
      "description": "No accepted D3 target-support row mapped for codex config_graph.",
      "status": "not_started",
      "claim_refs": [],
      "blocked_reason": "No accepted D3 target-support lane in current inventory."
    },
    {
      "behavior_family": "context_pack",
      "behavior_id": "codex_context_pack",
      "description": "No accepted D3 target-support row mapped for codex context_pack.",
      "status": "not_started",
      "claim_refs": [],
      "blocked_reason": "No accepted D3 target-support lane in current inventory."
    },
    {
      "behavior_family": "capability_surface",
      "behavior_id": "codex_capability_surface",
      "description": "No accepted D3 target-support row mapped for codex capability_surface.",
      "status": "not_started",
      "claim_refs": [],
      "blocked_reason": "No accepted D3 target-support lane in current inventory."
    },
    {
      "behavior_family": "tool_execution",
      "behavior_id": "codex_tool_execution",
      "description": "No accepted D3 target-support row mapped for codex tool_execution.",
      "status": "not_started",
      "claim_refs": [],
      "blocked_reason": "No accepted D3 target-support lane in current inventory."
    },
    {
      "behavior_family": "command_network_policy",
      "behavior_id": "codex_command_network_policy",
      "description": "No accepted D3 target-support row mapped for codex command_network_policy.",
      "status": "not_started",
      "claim_refs": [],
      "blocked_reason": "No accepted D3 target-support lane in current inventory."
    },
    {
      "behavior_family": "protocol_sessions",
      "behavior_id": "codex_protocol_sessions",
      "description": "No accepted D3 target-support row mapped for codex protocol_sessions.",
      "status": "not_started",
      "claim_refs": [],
      "blocked_reason": "No accepted D3 target-support lane in current inventory."
    },
    {
      "behavior_family": "resource_access",
      "behavior_id": "codex_resource_access",
      "description": "No accepted D3 target-support row mapped for codex resource_access.",
      "status": "not_started",
      "claim_refs": [],
      "blocked_reason": "No accepted D3 target-support lane in current inventory."
    },
    {
      "behavior_family": "provider_routing",
      "behavior_id": "codex_provider_routing",
      "description": "No accepted D3 target-support row mapped for codex provider_routing.",
      "status": "not_started",
      "claim_refs": [],
      "blocked_reason": "No accepted D3 target-support lane in current inventory."
    },
    {
      "behavior_family": "memory_compaction",
      "behavior_id": "codex_memory_compaction",
      "description": "No accepted D3 target-support row mapped for codex memory_compaction.",
      "status": "not_started",
      "claim_refs": [],
      "blocked_reason": "No accepted D3 target-support lane in current inventory."
    },
    {
      "behavior_family": "work_items",
      "behavior_id": "codex_work_items",
      "description": "No accepted D3 target-support row mapped for codex work_items.",
      "status": "not_started",
      "claim_refs": [],
      "blocked_reason": "No accepted D3 target-support lane in current inventory."
    },
    {
      "behavior_family": "side_effects",
      "behavior_id": "codex_side_effects",
      "description": "No accepted D3 target-support row mapped for codex side_effects.",
      "status": "not_started",
      "claim_refs": [],
      "blocked_reason": "No accepted D3 target-support lane in current inventory."
    },
    {
      "behavior_family": "projection_ui",
      "behavior_id": "codex_projection_ui",
      "description": "No accepted D3 target-support row mapped for codex projection_ui.",
      "status": "not_started",
      "claim_refs": [],
      "blocked_reason": "No accepted D3 target-support lane in current inventory."
    },
    {
      "behavior_family": "session_persistence",
      "behavior_id": "codex_session_persistence",
      "description": "No accepted D3 target-support row mapped for codex session_persistence.",
      "status": "not_started",
      "claim_refs": [],
      "blocked_reason": "No accepted D3 target-support lane in current inventory."
    },
    {
      "behavior_family": "replay_capture",
      "behavior_id": "codex_replay_capture",
      "description": "Accepted D3 inventory rows mapped for codex replay_capture.",
      "status": "c4_accepted",
      "claim_refs": [
        "breadboard_repo_integration_main_20260326/docs/conformance/support_claims/codex_cli_gpt55_e4_capture_probe_v1_c4_support_claim.json"
      ],
      "blocked_reason": null
    },
    {
      "behavior_family": "other",
      "behavior_id": "codex_other",
      "description": "No accepted D3 target-support row mapped for codex other.",
      "status": "not_started",
      "claim_refs": [],
      "blocked_reason": "No accepted D3 target-support lane in current inventory."
    }
  ]
}
